movie,sentence,score
그대가 조국,어제 범죄도시 2 보고. 오늘도 시간이 남아 아무거나 보자라는 마음으로 그대는 조국을 보게 됏는데. 아휴~~이건 뭐 범죄도시보다 더 범죄도시임. 우리가 살고있는 땅에는 진실과 증거는 없고 권력만 있음. 나라의 주인은 국민? 개뿔. 권력 하나로 협박하고 말 한마디로 확정하는 기사가 나오고. 돈 벌어서 자식새끼 먹여살리겟다고 별별 짓거리를 다 한다 이 생각만 들엇다. ,10
그대가 조국,장르가 가족사기극 범죄스릴러인가요?,2
범죄도시2,신세계에 이어 엘베씬 연출 대박그리고 빌런 손석구 포함 필리핀에서 온 2명도 기대이상이었음 손석구는 진짜 짐승같은 눈빛이었다 어쩜 저 사람이 구씨랑 동일인이라는건지 미쳤음,9
그대가 조국,2시간 내내 분노와 슬픔과 아픔이 한 숨과 섞여 나왔다~영화도중 더러 몇몇 남자관객들은 욕설과 함께 분노의 고함을크게 지르기도했다.우리 모두는 동의라고 한듯 아무말 못했다 나는 시원했다.나는 이제 검찰을 검사가 아닌 법기술자라고 부를것이다.왜 검찰개혁 언론개혁을 외치는지 궁금하면 이 영화를 보라~~한 방에 정리다그리고 법기술자의 선택적 정의를 받으면 나 또한 내가 조국이 될수있다는 것,10
비열한 거리,엔딩에 나오는 OLD&amp;WISE는 너무 탁월한 선곡이었다. 조폭영화지만 범죄와 액션에 치중하기보다는 드라마에 치중하고 있는 다른결의 조폭영화. ,8
포화속의 우정,"이런게 리얼전쟁드라마지!밴드오브브라더스처럼 남자들의전우애나 승리 등 긍정적인 부분위주 부각된거 보단,이렇게 조화롭게 모든 면을 아우르는 영화가 진짜인듯",10
범죄도시2,장이수 역으로 나온 인물이 감초캐릭터를 잘 살렸다.,10
투모로우,재난영화의 바이블. 영화를 보고 나올때 쯤 몸에 한기를 느낄수 있을정도니 더 설명이 필요하랴.,9
범죄도시2,타격감 최고! 정말 재밌게 봤어요!,10
범죄도시2,그냥 말이필요함? 개봉날 보고 어제 또보고옴 오진다 그냥,10
유체이탈자,나름 잘 만들었는데?액션신도 화끈하고 연출도 잘했고좋은데?,8
범죄도시2,너무 웃겨요 ㅋㅋㅋㅋ1편보다 더 코믹하네요 ㅋㅋ,10
범죄도시2,타격감이 느껴지는 통쾌한 액션 영화,6
그대가 조국,잘봤습니다ㅜㅜ...,1
그대가 조국,그대에게 진 빚이 너무 크다.,10
닥터 스트레인지: 대혼돈의 멀티버스,마블의 새로운 시도! 처음보면 당혹스럽지만 전체적으로 잘 만든 영화라고 생각합니다,10
그대가 조국,끝까지 응원합니다,10
그대가 조국,검찰개혁 조국수호 검착개혁 조국수호,10
언차티드,솔직히 프랜차이즈가 주는 엄청난 볼거리들을 빼면 단일영화의 완성도로는 스파이더맨 노웨이홈 보다 못할게 없다고 생각함,8
그대가 조국,울림이 있습니다. 꼭 보세요,10
범죄도시2,대단한 영화 1000만 보장,10
장르만 로맨스,재밌어요. 연애하고 싶어지는 영화.,10
범죄도시2,개꿀잼 이였습니다 ㅋㅋㅋ,10
범죄도시2,1편보다 막 그리 재밌지 않음 하지만 보통 2탄은 망하는게 보통인데. 그 우려를 불식할 만큼 퀄리티와 재미는 있었음 이러한 상대적 우려를 해소 한 면이 있어서  우려를 해소했다는 대견한 점수가 반영된듯 보임..하지만 그래도 이정도면 1탄에 따라 붙은 의미는 있으므로.굿.,8
범죄도시2,그냥 개꿀잼. 시간가눈줄 모르고 잘봤어요,10
범죄도시2,모든 배우들의 연기가 찰떡이었고 진짜 통쾌했어요!!!! 손석구 악역 연기도 짱!!!! 빵빵 터지고 재밌네여 ㅋㅋㅋㅋ,10
범죄도시2,마동석이 제일 무섭다 ㄷㄷㄷ,8
범죄도시2,1편 이기는 속편없다는말은 이영화랑은 관계없는듯.. 2편이 더재밌음ㅋㅋ,10
닥터 스트레인지: 대혼돈의 멀티버스,킬링타임용이라 해도 시간 낭비,2
범죄도시2,석구오빠 빌런이지만 사랑합니다 사랑해요 최고,10
범죄도시2,시간이 가는지 모르게 봣어요.대박입니다.,10
범죄도시2,장이수가 장이수했네ㅋㅋ,8
그대가 조국,윤석열의 민낯을 세상 모두가 알아야한다 검찰공화국 결사반대!!!,10
범죄도시2,굿 아주 재미집니다 ㅎㅎ,10
그대가 조국,비록 다큐멘터리 영화임에도 불구하고 지루하지 않고 몰입하게 되고 다시한번 우리 사회의 발전을 위해 생각해보는 시간이 되었네요,10
범죄도시2,진짜 너무너무 재밌어요 범죄도시 2에 버금가는 재미입니다 죽기 전 나에게 두시간이 주어진다면 전 이걸 보고 죽겠어요,10
가려진 시간,강동원 필모의 유일한 오점.,1
닥터 스트레인지: 대혼돈의 멀티버스,샘 레이미의 독특한 마블식 호러 영화. 만족스럽진 않지만 재밌게 봤다.,7
범죄도시2,"이게 15세 이상이라니!? 의아했지만, 배우분들 연기 너무 좋았고 손석구님 팬 되었심다.  오랜만에 극장에서 너무 재밌게 봤습니다 ",10
그대가 조국,ㅋㅋㅋ개웃기네ㅋㅋㅋㅋ,1
그대가 조국,뭔데ㅋㅋㅋㅋ 아직 안들어감?,2
시니어 이어,여주 비쥬얼 너무 몰입안되고 억지스러워서 ….,1
범죄도시2,재밌네요 악당분들 연기 잘 하셔서 무서웠어요...,10
청년 마르크스,제3세계 흑인 좌파 감독이 19세기 독일(유대인)지식인과 친한 척 한다..,4
그대가 조국,"조권의 친구 광고회사 사장과 포렌식 컴퓨터 전문가의 말이 인상적임. 검찰 조사 받으러 들어 갈 때, 철문 열리고 닫히는 소리, 이거 이래 유지되어야 하는가?, 포렌식 컴퓨터 전문가의 말, xx는 조작질의 xx. 인상적이고 기억에 남는다.",10
그대가 조국,진짜 정신병자들이 이리 많구나이딴 쓰레기영화를 버젓이 걸고 상영시키네기가막힌다 ㅋㅋㅋ,1
범죄도시2,인생작... 너무 재밌음!! ,10
굴뚝마을의 푸펠,화면 속에 들어가고 싶을 만큼 영상미나 작화가 예뻤고 판타지적인 배경과 이야기 속에서 주는 메시지가 좋았다 앞으로도 이런 애니메이션 영화가 많이 만들어졌으면 좋겠다.,10
닥터 스트레인지: 대혼돈의 멀티버스,"완다의 끊임없는 고뇌와 선과 악의 경계에서 필요 악으로 진화하는 일대기의 끝자락을 &amp;#34;다크홀드&amp;#34; 라는 변명으로 흑화해버린 마블 최초의 호러영화.닥터의 마법과 볼거리는 많고 숙련된 감독의 연출,영상미 열현하는 음악감독의 문제로 뛰어난 몰입감을 선사했으나 스토리는 지루했으며 CG로 커버하기에도 한계점이 보였음.결말은 주인공 완다의 행방 묘연으로 김샌 콜라를 마시는 느낌이 들었음.하지만 그외의 모든것에는 불편함이 거의 없었음.",9
범죄도시2,1편이 쫌더 재미있는거 같네요~~,8
애드 아스트라,솔직한 독백 나 자신과의 연결. 해왕성 까지 안가도 방에서도 할 수 있는 성찰이긴 함 ,8
걸어도 걸어도,개봉당시 극장에서 봤었는데 무슨 전원일기 드라마냐 하면서 하품하면서 졸면서 봤는데 마지막에 오열을 하면서 울었음. 지금도 그 영화 생각하면 눈물이 쏟아짐. 감독이 인생이 무엇인가를 잔잔하게 너무 잘그려냄. 다들 투덜투덜 불평불만하며 사는데 인생은 짧고 바람처럼 사라진다는것. ,10
그대가 조국,자승자박 조국선생님의 내리막 일변도의 일대기,1
범죄도시2,통쾌한 액션을 잘 살린 후속작입니다. 1편과 거의 비슷하게 재미있네요,6
닥터 스트레인지: 대혼돈의 멀티버스,기존 마블이 보여주던 영화보다 조금 더 가벼움,6
범죄도시2,전편보다 별로던데....그렇게 막 잼나지도않음,5
범죄도시2,마동석이 버스에서 손석구차서 버스에서 튕겨져 나왔을때 마동석이 벨안눌렀더고 다시 데리고 들어갔다면 더좋았울듯 ㅋㅋㅋ,10
유체이탈자,유대리가 제일 불쌍...,6
사이버 지옥: N번방을 무너뜨려라,성범죄는 문ㅈ부가 만든거아님?  지들도 권력형 성범죄 그렇게 심취해있는데말이야 ,8
그대가 조국,평점은 최대 1000자로 적어야합니다,2
범죄도시2,전작만큼 재밌네요^^배우님들 고생하셨어요~~,10
야차,22년도에 이렇게 밖에...,1
그대가 조국,이 나라에 종북좌익 좌파들이 많은것은 알지만 이렇게 많은지는 정말 몰랐다.,1
그대가 조국,검찰정상화가 꼭 필요함을 느꼈습니다.답답함과 분노가 일어납니다.우리가 할수있는것은 제대로된 투표입니다.꼭 투표합시다!,10
그대가 조국,제발 이성적 사고 없이 이리저리 선동되는 애들은 투표권 뺏자 특히 2-30대 여자들 정신못차림 어릴땐 아이돌 나이먹어선 트롯  빠순이기질이 DNA에 박힌 애들 정말 싫음 평점봐라 여기가 북한이냐 고졸이 의사코스프레하는 코메디에 대해서나 논해봐라 ,1
범죄도시2,굉장히 재밌습니다 추천,10
그대가 조국,2019년 당시부터 지켜보왔기에 너무나 잘 알고 있었지만... 다시봐도 너무 가슴이 아프고 화가나네요. 검찰공화국 개혁 반드시 해내야 합니다.,10
신과함께-죄와 벌,눈물겨운 화생방,5
닥터 스트레인지: 대혼돈의 멀티버스,영상은 매우 만족스럽지만 스토리가 지루했습니다,7
그대가 조국,이런 영화를 만드신걸 보니 정말 눈물이납니다...썩은 검찰공화국 대한민국이 왜 이렇게 됐는지 진짜 슬픕니다.윤석열 일가와 국힘당은 정말 부패된 곳임이 틀림없습니다.꼭 지방선거를 통해 민주당의 힘을 보여줬으면 합니다.,10
우주 전쟁,당시 미국인들이 마주쳐야했던 불확실한 공포감,8
범죄도시2,이수형도 웃기고 우리 구씨형님 연기가 지립니다,10
냉정과 열정 사이,음악이 다했다. 이 별점은 음악에게 드리는 찬사.명반이 따로없음..아오이 캐릭터가 원작과 느낌이 너무 다름.. .. 소설이 역시 찐.,10
범죄도시2,주변에 범죄도시1보다 재밌다고 하는데 1편 본사람이 맞나 싶다..,6
어부바,아이들과 함께 보기 좋은 영화네요~,10
4월은 너의 거짓말,"원작보다 못하다는 평가가 많았는데, 애니와 영화 둘 다 본 저는 영화도 나쁘지 않다고 생각했어요.오히려 오직 사람만이 표현할 수 있는 몽글몽글한 감성과 섬세한 연기가 전해져서 좋았습니다. ",10
파이프라인,7광구의 기억이 떠오르는 작품..  엉망진창 연출에 배우들의 좋은 연기가 오히려 독이 된거같다 이 영화의 감독이 유하님이었다는게 놀라고 내가 좋아하는 배우들의 연기 인생에 흑역사로 기록될 영화라 안타깝다 ,1
매스,마지막 그 장면은 일종의 종교적 체험이었다.,9
그대가 조국,좌파식 선거철 선동영화,1
그대가 조국,리얼 100프로 조작된 내용. 범죄자를 피해자로 둔갑시키는 좌파들의 특기를 제대로 보여줌,1
범죄도시2,액션은 전편의 기대를 충족해줌,10
닥터 스트레인지: 대혼돈의 멀티버스,나쁘지 않았음,9
그대가 조국,논란중인 인물에 대한 객관성이 결여된 스토리,1
들개들,차지헌 배우 잘보고 갑니다.,7
그대가 조국,정치는 현실입니다 감성이 아니라,1
그대가 조국,역사가 평가할것이다!조국가족에게 하루빨리 평화와 행복이 찼아오길,10
그대가 조국,믿고 싶은 것만 믿는자들,1
쥬라기 월드,주인공이 나쁜놈인게 총을 들고 있으면서도 동료가 랩터에게 물리는 상황에서 총을 안쏘고 도망감. ,5
그대가 조국,참담했다....그리고 문재인대통령의 최대의 실수...검찰총장 인사....ㅠㅠ괴롭다...할 수 있는게 없다는 사실이...,10
범죄도시2,너무 재밌었습니다! 속이 뻥 뚤리고 스트레스 해소 되었어요!,10
범죄도시2,형사님들 연기가 너무 좋네요~재밌게 잘 봤습니다.3편도 기대하겠습니다~^^,10
범죄도시2,오랜만에 웃기고 통쾌하고 슬프지 않아서 좋았다,10
그대가 조국,당시 광기를 느낄수 있다. 검찰개혁과 언론개혁이 얼마나 필요한지를 뼈저리게 느낀 영화,10
범죄도시2,손석구가 진짜 소름돋게 연기잘하더라고요 마동석은 원래 연기를 잘하시니까 그래도 재밌게 봤어요 징그럽긴 했지만ㅁ,10
유혹의 계절,애기들은 이해 못하고 킬리언 머피 욕 할 듯 근데 저게 현실이다  갠적으로 웨이트리스가 젤 예쁘네 ㅋ 킬리언 머피도 잘생겼고 역시 잘생기고 봐야되나 ,10
그대가 조국,이걸 보는거 자체가 수치다.  이사회에서 선동. 거짓말. 가짜진보놀이로 특정지역. 특정계층을 이용해  호의호식하고 권력자행세하는 남한공산당은 씨를 말려야 한다.,1
그대가 조국,이걸 보는거 자체가 수치다.  이사회에서 선동. 거짓말. 가짜진보놀이로 특정지역. 특정계층을 이용해  호의호식하고 권력자행세하는 남한공산당은 씨를 말려야 한다.,1
그대가 조국,1점도 아깝다. 범죄자 옹호영화냐. 검찰이 문제면 범죄자 죄가 없어져? 사기꾼 집안이던데 모친도 수사해야지. 조국 일가에 대한 특별대우 너무 심하다. 무슨 사이비종교 교주쯤 되나? ㅋㅋㅋ,1
그대가 조국,우리가 알지못햇던 진실이 이렇게 숨겨져있고 어론에 보도대로만 믿고 나도 그렇게 믿고있다는게 내 자신이 믿워요조국님 힘내세요,10
야차,볼라고했는데  평점이너무낮네,2
인연을 긋다,"어머니 모시고 같이 봤습니다....눈물맺히신 모습 보니까 저도 뭔가 마음이 뭉클 하더라고요..누군가의 시어머니, 며느리,엄마라면 공감과 위로가 될만한 영화같습니다",10
소설가의 영화,"영화를 만들고자 하는 소설가의 입을 통해서 전해지는 홍상수의 영화론, 예술론, 어쩌면 인생론. 억지로 꾸며내지 않고, 과장하지 않고, 있는 그대로 바라보고 정직하게 드러내는 것.",9
위대한 소원,막장처럼 보일 수도 있으나. 친구가 죽는다고 들었을때. 누구라도 저 발광을 하지 않을까? 진정한 친구가 있다면 누구라도 이해를 할 수 있을것이다.,10
닥터 스트레인지: 대혼돈의 멀티버스,조금 어지러움,10
닥터 스트레인지: 대혼돈의 멀티버스,화려한 영상미와 의외의 존재의 등장,10
파이프라인,맞네요 3류 본시간이아까움 ,2
그대가 조국,캬~ 신천지 저리 가라 선동세력 블랙리스트 사알살 녹는다.,1
그대가 조국,캬~ 신천지 저리 가라 선동세력 블랙리스트 사알살 녹는다.,1
그대가 조국,ㅋㅋㅋ 그저 웃고갑니다 부끄러운줄 알아야지!,1
그대가 조국,.,1
모비우스,연출.전투 꽤좋음다만 때를 잘못타고 개봉했다 ,8
그대가 조국,ㅋㄱㅋ이런걸 영화라고?,1
범죄도시2,조금만 더 패줬으면 해서 9점 드립니다,9
그대가 조국,핵노잼 왜 만들지 ???이상하네??,1
범죄도시2,시원한 액션. 최고     ,10
범죄도시2,"보통 영화1편이 흥하면 2편은 기대에 못미치기 마련인데.. 범죄도시2는 1편이랑 각각 다른느낌이면서 영상미나 연출, 싸움씬 등이 더 업그레이드 된거 같고 지루할 틈이 없었던 한국의 대표 범죄영화인거같아요 ! 범죄영화 하면 범죄도시가 가장 떠오를 정도로 기억에 남네요 !",10
어부바,하...그래도 예전에 나름 잘나가던 정준호인데 이런 수준 낮은 영화에도 덥석 출연하는거 보니 세월을 거스를순 없네,4
범죄도시2,징그럽지만 재밌다.. 마동석 배우님 초반 연기톤이 좀 어색하지만 점점 가면서 자연스러워지고 아주 좋았다!,9
그대가 조국,조국은 조국으로 반박가능 ㅋ 조국이 무슨 신이라도 되는 양 조국 수호 타령하는 띨띨이들 콜라보,1
범죄도시2,너무재밌어요 다들 꼭 보세요,10
범죄도시2,구씨 추앙하러 오늘 또가는 나,10
범죄도시2,시간가는줄 모르게 진행이 너무 좋왔고 마동석 님과 반장님의 캐미가 정말 재밌었던거 같아요 꼭 영화관에서 보시는걸 추천 합니다. ^^,10
범죄도시2,킬링타임용으로 딱 좋고 형사님들 연기가 편해져서 너무 보기 좋았어요 손석구배우님 너무 좋아요..,8
다운폴,짤 영상으로 탑티어 영화.,10
범죄도시2,걍 웃음 포인트가 많아서 좋았고 액션도 스토리도 간만에 영화관가서 재밌게본 영화!! 최고입니다. 코시국에 보면 좋을 영화 ,10
범죄도시2,마동석 몸이 더 커진거 같아요 ㅋㅋ,10
범죄도시2,전작과 비슷한 연출이 많아서 식상하지만 재미있었음,7
유체이탈자,윤계상 은근 섹시하단말야,10
그대가 조국,영혼보내기 ㅈㄴ하겠네 쿵쾅이들 밖에 나가기엔 무서우니 ㅋㅋㅋ,1
범죄도시2,3년의 코로나 스트레스가 한방에 날라가는 기분!,10
범죄도시2,마동석 파트너 웃겨 ㅎㅎ,10
그대가 조국,역사에서 사라져야할 개쓰레기 좌빨집단영화,1
닥터 스트레인지: 대혼돈의 멀티버스,조금은 유치한 부분들이 있었지만 킬링타임으로 보기에는 괜찮았어요.,7
범죄도시2,액션도 최고 배우연기력도 최고사이다같은 영화 감사합니다,10
범죄도시2,재밌음ㅋㅋㅋㅋㅋㅋㅋ,10
그리스도 디 오리진,만들려면 좀 잘만들자  이렇게 허술하게 만들어서 신도가 늘겠냐,3
모가디슈,이제야 넷플로 봤는데 코로나만 아니였음 관객수 정말 많았을것 같다는 생각이 들었네요. 집에서 노트북으로 봤는데도 긴장감 있고 재밌었어요! ,10
그대가 조국,다들 보셔야 할 영화,10
범죄도시,잼있었다.2도 재미있다,10
범죄도시2,"구씨 마블리 그리고 강이수까지,, 올해 첫 극장영화로 완벽한 시작이었다",10
범죄도시2,구씨 너무 무서워. 마동석은 이제 코믹 연기 물이 올랐음. 쭉 시리즈물로 해주세요. 여기 나오는 형사님들 너무 사랑스러움,8
범죄도시2,역시 믿고 보는 마블리..버스 격투씬 에선 아드레날린 뿜음..ㅋㅋㅋ,10
범죄도시2,기대했던것 보다도 더 좋았던 영화~연출 연기 감동 재미 모든요소를 완벽하게 구사한 영화~~~강추합니다,10
그대가 조국,그대가 조국에 공산화를 막았오 감사드리오,1
그대가 조국,멋진 영화이다. 모든 시민이 보길 바랄뿐이다.,10
록 스탁 앤 투 스모킹 배럴즈,재미있었다면 다행이고..,6
그대가 조국,범죄느와르물이 드디어 나왔네요,2
그대가 조국,감사합니다. 좋은 영화 만들어주셔서. ,10
킹스맨: 퍼스트 에이전트,이정도면 볼만한데 불만이 많네,7
범죄도시2,시원하다통쾌하다크크크크,10
범죄도시2,강추완전재밌어요ㅠㅠ 1보다 훨씬재밌어요 짱짱!,10
그대가 조국,"범죄자 찬양 영화를 왜 봄? 무조건 종북빨갱이거나, 멍청하거나 둘 중 하나",1
롤러코스터,시대를 앞서간 띵작이라 생각함,10
닥터 스트레인지: 대혼돈의 멀티버스,대박 재밌음,10
범죄도시2,마동석이 하나의 장르가 되었다,10
그대가 조국,정신차리고 살아야겠습니다.,10
그대가 조국,텀블벅 후원으로 시사회 다녀왔습니다. 많은 분들이 보면 좋겠습니다. 적극 추천입니다. ,10
범죄도시2,그냥 봐야 됨…그리고 네이버에 평점남기로 올듯,10
범죄도시2,재밌당!! 마동석 액션 시원해요 패는 소리도 시원하구,10
뜨거운 피,나름 잘만든 느와르 영화인거 같은데 관객들에게 호응은 못받은거 같아 아쉽네요 배우들 연기 정말 잘하네...,9
트루먼 쇼,보는 내내 소름이 돋았습니다... ,9
그대가 조국,검사는 정치질 그만하고 윤씨는   두눈감고 죽질 못 하길..,10
그대가 조국,조국 법무부장관님이 걸어온 가시밭길을 영화로 담대하게 잘 표현해주어서 좋았어요. 가슴 아픈 내용이지만 현실이라는게 더 안타깝습니다. 주말에 강추하는 영화입니다.,10
범죄도시2,손석구 밖에 안보여요..너무 멋져,10
그대가 조국,국민이라면 꼭 봐야할 영화입니다.,10
범죄도시2,"와우 1편이랑 비교해도 손색없을만큼 액션, 코믹, 연기력 두루 갖췄네요 너무 재밌게 봤어요ㅎㅎ 그리고 손석구배우 연기 너무 잘하네요 다 보고 나와서 손석구배우밖에 생각 안남..",10
그대가 조국,봤는데 뭐 북한식 프로파간다 체제선동 영화 그수준 ㅋㅋ,1
그대가 조국,조국 앞에 부끄러움이 무엇인지를 모르는 인간의 추악함을 확인하는 순간과 시간이였다.,10
그대가 조국,이런거 다른 코로나로 힘든배우들 기만하는거 아님?? 윤통 백화점갔다고 소상공인 생각 안하냐는거랑 뭐가 다름 생각 겁나없네,2
닥터 스트레인지: 대혼돈의 멀티버스,완다비전을 보고가지않아서 완다가 왜 저렇게까지하는지 이해하기 힘들었는데 완다비전을 보고나니까 10000% 이해가 되벌임..그러니까 꼭 완다비전을 보고가는걸 추천,8
그대가 조국,"보는 내내 먹먹함, 검찰의 조작수사에 대한 공포감이 교차해서 슬펐습니다.",10
그대가 조국,"국내 탑클라스 거짓말쟁이, 내로남불의 대명사 조국이 여기에서는 선량하고 무고한 피해자?!",1
닥터 스트레인지: 대혼돈의 멀티버스,이런 쓰레기를 돈주고 보다니..닥스+고어물+억지교훈+클리셰 범벅+설명충이 계속 등판하는데 디즈니 플러스 안보면 절대 이해 못함진심 개쓰레기 영화평점 높게 주는 사람들 믿지 말길..전형적인 &amp;#39;나만 당할 수 없다&amp;#39; 심보인 듯,1
범죄도시2,역시 마동석이지 조연들도 잘했음,10
범죄도시2,속편은 보통 전편만 못하다고 하는데범죄도시2는 정말 전편을 넘어서는 유머와 액션더 강해진 마동석...마블의 영웅을 보는듯한 느낌과영화가 끝날때까지 이어지는 긴장감과 허를 찌르는 유머코드에시간가는줄 모르고 봤어요^~^,10
그대가 조국,하다하다 이제 이런 쓰레기를 영화를 만드네,2
범죄도시2,1편 장첸은 순한맛이었네요.. 스토리 질질 끌지도 않고 시간 가는줄 모르고 봤습니다. 특히 1편의 혼자야? 어나싱글이야 에 버금가는 엄청난 대사가 있음ㅋㅋ 암튼 1편보다 더 나은 속편이 나와서 다행입니다. 천만돌파 가능할듯,10
그대가 조국,우리 모두가 조국한테 빚을 졌다,10
그대가 조국,우리 모두가 조국한테 빚을 졌다,10
그대가 조국,우리 모두가 조국한테 빚을 졌다,10
범죄도시2,마동석 타격감이 시원시원해서 오랜만에 영화관에서 재밌게 봤어요^^,8
그대가 조국,"검찰, 언론, 사법부의 부패 기득권 카르텔이 어떻게 개혁을 좌초시키고 개혁에 앞장선 사람과 그 가족을 사회적으로 매장시켜 버리는지 여실히 보여준 영화. 내가 당할 때까진 모른다는 게 두렵고 서글프네요.",10
범죄도시2,"영화 재밌게 잘 봤습니다~~~역시 마동석 액션! 통쾌하네요~단, 이건 청소년이 보기에는 적절치 않다고 생각합니다.",9
사도,영조가 너무오래살았어..적당히살다죽고 사도가했어도 잘했을텐데...사도가불쌍하다...,8
범죄도시2,진짜 너무 재밌어요 손석구배우님 연기도 연기인데 눈빛연기가 장난아니에요 이정도로 몰입이 될 수가 있구나싶을정도로 빌런역할 너무 잘하시더라구요 보면서 살기가 화면 뚫고 나올정도로... 근데 오히려 캐릭터가 매력있게 나와서 빌런이 더 좋게 됐네요ㅋㅋㅋ 아무튼 한 번 더 보고싶을 정도로 재밌습니다 그니까 Vod나올때까지 존버 좀 탈게요*^^* ,10
그대가 조국,꼭 봐야합니다. 공정과 상식이 통하는 나라가 빨리 왔으면 좋겠어요 ,10
그대가 조국,모두가 보고 느낄수 있기를,10
그대가 조국,"항상 강대강이 맞다고는 생각하지 않는다.. 하지만 강하게 해야할 때는 해야한다.. 항상 저들은 비열하니까, 고리를 끊어줄 사람이 필요하다.. 정권 연장이 됐다면 기대해 봄직했는데.. 조국 교수가 정치를 했으면 좋겠다.. 무도한 이들과 싸우는 데 신사일 필요는 없다.. 정의가 항상 승리한다고 보진 않는다..",10
범죄도시2,마동석한테 한 대 맞아보고 싶다.,10
그대가 조국,와 진심 머가리터진 인간들 많구나ㄷㄷ,1
히든,내 잃어버린 시간을 히든카드로 되찾고 싶다...,1
그대가 조국,더럽다추악하고 이런게 공정이구나,2
