movie,sentence,score
그대가 조국,몰입도 대박..더운날이 었는데 등골에 서늘함이 여전했었다. ,10
범죄도시2,진심 재밌다 ./....,10
닥터 스트레인지: 대혼돈의 멀티버스,...뭐라고 해야할지 모르겠으나 상당히 땅콩만한 심장을 가진 나는 굉장히 긴장하면서 봤음.,6
범죄도시2,전편만큼 재미있는 후속작!,10
범죄도시2,너무너무너무너무너무,10
그대가 조국,꼭 봐야할..   꼭 알아야할.. ,10
그대가 조국,조국 전 장관과 주변 사람들이 당한일에 10분의 1도 못 담은 것 같지만....너무 참혹합니다!,10
그대가 조국,차분히 돌아봐야 할 사건을 시간순서 그대로 따라가 봤음.,10
애드 아스트라,&amp;#39;그래비티&amp;#39;에서 가져온 듯한 장면이 3~4 개 있음.,9
그대가 조국,언론에 얼마나 깜쪽같이 속아왔는 모든 사람이 알아야한다. 검찰과 언론이 썩었다 썩었다해도 이 정도일 줄이야. 심각하다. 증거를 조작하고 그걸 언론이 퍼트리고 국짐당은 생쑈를 하며 사람을 몰아가고 판사는 반대증언을 듣지 않는다. 맘만 먹으면 마음에 들지 않는 누구든 범죄자가 될 수 있다. 당신도 될 수 있다. ,10
부기나이트,"걱정마, 지금 죽더라도 우린 계속 살아가게 될꺼야. 뫼비우스의 띠 처럼. 흠... ",8
범죄도시2,“형사 아니죠..?”“…내 그래 보입니까?”웃참 부분이 킬포,9
범죄도시2,"살짝 잔인하긴 했지만 주조연등 연기랑 연출, 스토리 다 괜찮았어요.",9
그대가 조국,결론은 문재인대통이 윤석열이를 검찰총장으로 올리는 악수를 둬서 대통령까지 됐다는 이야기인데...아니면 윤통 건희가 신분최고점을 찍기위해 철저히 욕심을 숨기고 있다가 총장에서 대통령까지의 시나리오를 완성한건지 ,10
승리호,재밌네요 연기 잘하는 배우만 모아놔서 더 몰입하고 봤어요,10
그대가 조국,대깨문 맞춤 영화. 일반인은 공감불가.,1
오아시스,이 영화로 하고 싶은 이야기가 뭐냐?,1
그대가 조국,누구나 조국이 될수있다.,10
범죄도시2,진짜ㅋㅋㅋㅋ 시간 가는 줄 모르고 봤어요 중간중간에 코미디스러운 배우들의 연출이 너무너무 재밌어서 전혀 지루하지 않게 잘 봤어요 웃음이 끊이질 않았다는ㅋㅋㅋ 특히 마동석 배우님 연기는 말할 것도 없고요 벌크업을 더 하신건지 몸이 더 커지셔서 더 멋있었어요ㅋㅋ 싸우실 때 주먹으로 퍽! 하는 소리가 영화관에 울려서 진짜 좋았어요! 최근까지 본 영화중에 범죄도시2가 제일...,10
그대가 조국,나의 평범한 일상도 어느날 조국장관님 같은 뒤집어씌우기 범죄자로 만들 수 있을거라는 끔찍한 검찰의  불공정앞에 분괴한다,10
범죄도시2,1편보다 더 화려해진 액션과 스케일이 돋보이는 작품이었습니다.,8
범죄도시2,평룐가 아닌이상 그냥 재밌게 볼수있음 ,9
범죄도시2,쉴틈없는 액션.지루함은  잊어라!,10
범죄도시2,진짜엄청재밌어요강추드립니다,10
몬스터 싱어: 매직 인 파리,스토리는 좀 단순했고 반전이나 액션등은 없었지만 서정적인 노래는 너무 신나고 재미있었다..,10
블랙 위도우,안좋은점만 말하자면 액션 너무 구림 노잼 개그,4
카오스 워킹,별거없는 내용으로 시종일관 질질끔..기억에 남는건 딱하나 &amp;#34;아임 토드휴잇&amp;#34;,2
시니어 이어,사람을 20년간 코마에 빠지게 만든건 왜 안푸는지?? 쌍둥이 매수해서 떨어지게하는거 거의 범죄인데. 감독이 내용을 쓰다 수습을 이상하게 급마무리함. 전형적인 하이틴 미국영화 수준도 안됌. 그리고 37살이라는데 50살같은 배우들가져다쓴것도 문제임,2
생각보다 맑은,"단편 모음인데 흐름 없이 툭툭 끊기고, 스토리텔링도 가볍고 여리다. 그림체의 매력과 바이브는 살아있어서 차기작을 기대케.",5
범죄도시2,존잼.... 스트레스 완전 풀림,10
범죄도시2,존잼존잼개존잼씆존나잼,10
카오스 워킹,생각노출. 신박하다. 긋~~~!,8
그대가 조국,히틀러 괴벨스에  선동된 독일개돼지들이 유태인학살을 지지하듯 조국 지지하는것들도 인집부조화인듯,2
유체이탈자,윤계상 연기 최고네요몰입감 엄청남,10
범죄도시2,제 꿈은 오늘부터 마동석입니다,10
그대가 조국,ㅠㅠㅠ 정말 속상하다...,10
어부바,재밋게봣네요 슬픈영화도맞지만 코믹영화네요 ,10
내 사랑,인생은 사랑으로 완성 된다. 서정적으로 마음을 울리는 영화였다.,10
아마겟돈,맨날 영웅은 미국이라지만 재밌는걸 어쩌겟음.. 스토리 캐릭터 설정도 다 좋고 98년도 퀄리티는 말할것도 없고 감동까지ㅠ 브루스윌리스는 역시 찰떡이고 힙한 영화음악까지 굳,10
범죄도시2,재밋음  연기잘하고 재밋으요,8
안녕하세요,감동적이지만 너무 예상이 가는 그런 영화얐습니다. 뻔한스토리로인해 지루했지만 또 이상하게 위로가 되고 눈물 펑펑쏟음.,6
더 배트맨,무겁고 어두움.  스토리가 중요.,7
그대가 조국,우리가 사는나라의 추악함을 제대로 보여줍니다 조국을 욕했던 제 자신이 너무 부끄럽습니다 윤석열 빨리 뒤지길 기원합니다,10
범죄도시2,"진짜 너무 재밌어요 ㅠㅠ 3,4,5.. 그냥 계속계속 나옴 좋겠어요 ㅠ ㅠ ",10
카오스 워킹,망하는 영화는 세부 디테일에서도 센스가 없는 포인트가 있다. 귀여운 건 끝까지 살리는게 센스다. 한심한 감각으로 만드는 영화는 똥보다 못한 자원 낭비일 뿐이다. 다른 부분이 아무리 잘 만들어도 비호감이 되버려서 보기가 싫다.,1
범죄도시2,범죄도시재밌어요 3편도 내주세요,10
그대가 조국,"검사는 피고인을 고를 수 있다... 영화를 보며 21세기인지, 남영동 이야기인지 혼란스러울 정도였다. 영화의 이야기는 정말 담담하지만 나나 관객은 억울한 감정에 압도당하고, 때로는 호흡을 다스리는게 버거울 정도였다. 담담하지만 고통스럽고 결코 남 이야기가 아닐 영화의 말미에선, 영화 내내 역시 고통스러워하던 장경욱 교수가 뜻밖의 희망을 말한다. 그 터널 끝의 희망이 하루 빨리 조국 전 장관과 그 가족들에게 나타나길 기도하고 또 기도한다.",10
그대가 조국,중립적으로 잘 만들어진 다큐이다 정말 많은 사람들이 봤으면 좋겠다 언론 헤드라인 뒤에 있었던 진실을  알 수 있도록,10
혐오스런 마츠코의 일생,공감이되는이야기 한여자의 인생,10
그대가 조국,범죄자보고 작작좀 해라,2
스파이더맨: 노 웨이 홈,삼파이더맨 개간지고 짱 재미씀,10
우연과 상상,"가상과 현실, 기억과 관계",10
그대가 조국,전형적인...광우뻥 선동 수준 ㅉㅉㅉ,1
범죄도시2,역시 믿보배 마동석 배우님 입니다.스토리는 1편보다 좋았어요^^근데 초반에 너무 잔인한 장면이 많은편인데 15세관람이라는게 이해 안가더라고요.,10
그대가 조국,친구가 공짜로 영화 보여 준다고 해서 봤는데 종교 같은 영화였습니다. 무교이고 난해했던 영화였습니다. ,1
버드 박스,소재만 있고 내용은 없는 전형적인 넷플 영화. 상황은 흥미돋지만 내용은 진부하고 결말도 없음. 콰이어트 플레이스가 개인적으로 훨씬 좋았다. 하지만 산드라블록의 연기는 최고였다. 50 나이에 임산부역할이 아무렇지도 않은 동안도 한몫!!,7
범죄도시2,한국 경찰들아 총 좀 쏘자암 걸리겠음....,7
사이버 지옥: N번방을 무너뜨려라,방 안에서 구경하고 동조했던 사람들도 구속시켜야하는거 아닌가요? 정말 끔찍합니다.,10
그대가 조국,"가슴 아프다. 알고 있었지만 놀랐고, 21세기 대한민국에서 벌어졌다고 믿지 못할 일에 내내 분노와 슬픔이 치밀어 올랐다.",10
닥터 스트레인지: 대혼돈의 멀티버스,닥터가 아닌 완다가 중심이 되는 아쉬움....닥그래도 나름 볼거리가 화려해서 볼 가치는 충분히 있음,8
나이트메어 앨리,성공의 욕망이 부른 파국,8
범죄도시2,범죄도시 1보다는 긴장감이 없을수 있는데 재미까지 합치면은 2가 훨씬 재밌어요~,10
타임 투 킬,흑백을 떠나 아동성범죄자들은 처단해야한다.. 신체적 손상을 더불어 기억을 잃지 않는 이상 평생을 정신적으로 죽여버리는 것과 마찬가지인데.. 검사는 법으로 처벌해야 한다는데 법이 제대로 처리해주지 않으니 부모가 죽이고 싶은게 당연한게 아닌가. 우리나라에선 인종차별을 떠나 저런상황에서 보복살인이라고 정당방위 무죄 나오지도 않을 것을 생각해보면 그래도 미국은 재판을 통해 무죄가 나오기라도하니 부럽게 느껴졌다. 내용도 감동적이고 연기도 너무 좋았다. 아이가 잔혹하게 당하는 부분을 자극적이고 길게 표현하지 않았어도 상황에 깊이 몰입하게 해주었다. 마지막 사무엘잭슨과 딸이 안는 장면은 조금 인위적이었지만 너무 아련했다ㅠㅠ 다만 러닝타임이 길어 좀 늘어질때가 있고 중간에 산드라블록이랑 불륜 상황은 왜 넣은건지 이해 불가.. 그 캐릭터가 굳이 필요하지도 않은데ㅠ 그래서 9점,9
범죄도시2,누가 5야 ㅋㅋㅋㅡ뉴ㅠ,10
범죄도시2,웃으면서 오랜만에 영화봤어요~마동석짱!!,10
프로메테우스,리틀리랑 동시대에 살고 있다는건 축복.오래오래 사셔요.,10
그대가 조국,생각햇던것보다 충격적이었어요,10
범죄도시2,1분도 지루하지 않았음...간만에 재밌게 본 영화b,10
사이버 지옥: N번방을 무너뜨려라,다들 꼭 봤으면...나의 일이 되었을지도내 친구의 일이 되었을지도 모른다.,10
범죄도시2, 1에 못지않게 재밌기가 쉽지 않은데 배우분들 연기도 그렇고 스토리도 너무 재밌네요 계속 나왔으면 하는 영화에요,10
그대가 조국,내가 조국이야? 내가?,2
"나는 내일, 어제의 너와 만난다",그냥 명작이다. 꼭 보내세요ㅠ,10
범죄도시2,완전  최고로 재미있어요,10
범죄도시2,마석도 유니버스 최강 마동석,10
그대가 조국,영화를 보는 내내 마음이 아팠습니다. 많이 힘드실텐데~ 하루 빨리 조국님의 가정에 평안이 찾아오길 간절히 바랍니다. 힘내십시오! 응원합니다.,10
범죄도시2,역시 마동석액션 시원시원 스트레스 팡팡풀려요 손석구연기도쩔탱,10
닥터 스트레인지: 대혼돈의 멀티버스,"땅콩만한 심장을 가진 사람이라 나도 완다, 닥스 따라 좌석에서 공중부양함",7
범죄도시2,역시 마동석만의 파워넘치고 호쾌하고 시원한 액션은 기대를 저버리지 않는군. 또한 손석구를 캐스팅한것도 1편의 윤계상만큼이나 강렬한 빌런으로서 괜찮았음 !,10
그대가 조국,이 시대에모두가 조국이 될수 있음에 소름이 돋았습니다제작자와 출연진 모두의 용기에 감사드립니다 ,10
범죄도시2,진짜 너무 재밌어요..ㄹㅇ 액션감 최고 잔인한것도 많았는데 ㄹㅇ 재밌음 1년동안 재밌는 영화 없었는데범죄도시가 짱인듯..,10
범죄도시2,"왠만하면 평 잘주는데 이걸 영화라고,  도시1 보다  긴장감도 없고.  스토리도 없고 연기도 수준이하 이다",2
범죄도시2,1 보다 더 재밌는 거 같음 석구형 사랑해,10
아수라,"이재명의, 이재명에 의한, 이재명을 위한 막장 영화. 시장=이재명",10
범죄도시2,간만에 정말 재미있는 영화 ,10
그대가 조국,보는 내내 두려움과 미안함 때문에 괴로웠습니다. 한 가족을 이토록 무참히 짓밟는 광경을 보고도 진실을 왜곡하는 기자들 때문에 잘 몰랐다는 변명 이제 그만 해야 합니다. 진실을 알 수 있는 통로는 많아요. 모두 깨어납시다. ,10
범죄도시2,믿고 보는 마동석입니다 오랜만에 재밌었어요,9
그대가 조국,국가전복세력 미화 영화,1
신비한 동물들과 덤블도어의 비밀,재밌음,8
오마주,그래도 살아남아줘서 고맙다. 내일도 우리 살아내자 ,10
그대가 조국,우리 시대의 현실. 아직도 독재시대,10
그대가 조국,눈 감지 말고! 우리가 조국이다! ,10
그대가 조국,"우리 사회의 기득권의 중심에 검찰이 있음을 다시 확인하는 시간이 되었습니다. 내 편이 아니면 적으로 생각하고, 제거의 대상으로 여기는 집단! 그들이 휘두르는 보이지 않는 칼날은 우리에게 늘 겨눠져 있음을 알게 되는 시간이었습니다. 이미 너무나 잘 알고 있는 사실과 진실이 있지만 치가 떨리고, 가슴이 미어지는 세월을 다시 한번 되뇌이게 되네요. 꼭 보세요. 반드시!! 지방선거에도 개돼지가 되지 않으려면 꼭 보셔야 합니다.",10
그대가 조국,흠  .. 매우매우 곤란하다^^,2
그대가 조국,남들 다 아는데 본인만 모르는 정신장애의 불쌍함이 느껴짐.,2
닥터 스트레인지: 대혼돈의 멀티버스,이래나 저래나 닥스는 좋다~~,10
남자가 사랑할 때,아 진짜 슬퍼 마지막 ㅜㅜ,10
범죄도시2,추천요 재미게봐서요한국영화  많이좋아져서요,10
공기살인,현재까지도 아무도 책임지려 하지 않아 해결되지 않는 문제가 마음이 아프고 먹먹 합니다.사람들의 관심안에 계속 머물기를 기도합니다.힘내세요.,9
그대가 조국,정치색없이 살고싶어도 이영화보면 그럴수 없게됩니다 ㅠㅠ,10
범죄도시2,스토리 액션 연기 모두 만점입니다 ,10
범죄도시2,간만에 만족스런 영화를 봤네요.다른분 평처럼 1 보다는 스토리는 좀 밀리나배우들 연기력이나 액션은 볼만해요.마동석배우의 뻔한듯한 주먹 실력도 이번에는통쾌하기만 했네요...ㅎ코로나로 갇혀(?) 지내던 마음에 시원한 탄산수 마시는거처럼 웃으면서 봤어요.ㅎ손석구배우 표정연기....굳!~ ,9
카페 소사이어티,우디 앨런의 영화에서는 젊은 순간의 미숙함과 인생의 덧없음이 보인다.,9
범죄도시2,와 정말 진짜 너무너무 재밌어요ㅠ 중간중간에 넣은 코미디 장면과 다른 장면들의 조화가 정말 좋아요!! 꼭 보시기를 추천드립니다~!!,10
미드나이트,고구마를 몇개를 먹여야 사람들이 숨이 막혀죽는지 감독이 실험한 영화저도 숨막혀서 죽었었는데 옆에 와이프가 심폐소생술해줘서 겨우 살아나서 리뷰답니다혼자보면 안됩니다 주의하세요,1
그대가 조국,정유라는?? 똑같은 사냥일뿐 ,1
더 노비스,넘쳐나는 테스토스테론(원래 남성호르몬임)을 주체못해 사회생활 파탄나는 여대생이야기...,8
그대가 조국,허상에 가려진 기울어진 현실,10
유체이탈자,"개인적으로 윤계상 연기를 좋아해서 나온 영화는 다 챙겨봤는데 이 영화의 가장 큰 실수는 계속 윤계상만 보여준다는거다 비슷한 소재로 장르가 다른 뷰티인사이드 처럼 겉모습이 바뀌어도 내면은 같은, 그러니까 연기자는 계속 바뀌지만 하나의 사람을 연기하는 식으로해야 몰입감이 사는데 백날 남이 중사 상사 부장 불러봐야 보이는건 윤계상이라 몰입도가 굉장히 낮아진다 바뀐 모습을 거울이나 액션 외 씬에서 아주 잠깐씩 보여주는게 너무 난해하게 다가왔다 반대로 적용했다면 훨씬 좋았을것. 후반부 총격씬은 존윅 오마주인가?",5
범죄도시2,딱 두 대사에 빵터짐1. 니 내가 누군지 아니? (장첸버전)2. 누가 5 야?,8
소년 아메드,아메드 이젠 정신차려.,8
그대가 조국,이 시대를 살아가는 대한민국 국민이라면 꼭 봐야할 영화,10
그대가 조국,눈살찌푸리는 별점테러덕에 처음으로 평점답니다,10
그대가 조국,검찰과 언론이 얼마나 무서운것인지 깨닫게된다,10
강철중: 공공의 적 1-1,지금 봐도 재미있어요.,10
어부바,이런거 처음쓰는데 너무 화나서 쓴다뭐이런 삼류도 아니고 사류 오류 영화가 다있냐 1000원 내고 봤는데 단돈 1000원도 아까운건 처음이다 이것도 영화라고 만든 하.. 이건 그냥 시간과 돈을 쓰는 시청자들을 농락한거 아닌가도저히 못보겠어서 중간에 그냥 티비 끔 ,1
범죄도시2,극장에서봄 ... 2022년도 영화가 2g 애니콜 배경이라는것도 놀랍고.. 추억의 아방 같은 차 등장 .... bus는 파랑색 현재 버스..ㅋㅋㅋ 옥에 티...   그냥.. 저냥...볼만함.... 1편수준....,7
범죄도시2,1편에뒤지지않음  개잼남,10
범죄도시2,잔인한거 못보면 재밌는지 모름. 이게 어떻게 15세를 받았지? ,6
그대가 조국,검사는 피고인을 고를수있다.정경심 교수의 표창장위조는 검찰들의 조작증거로 유죄를 만듭니다. 칼을든 검사와 기득권자들의 만행. 쥐뿔 아무것도 없는 멍청한 시민들의 절대지지.. 보는동안 답답함과 앞으로 5년이 어떻게 될지 막막합니다,10
범죄도시2,오늘 아내와 봤는데 역쉬 재미있네요^^,10
범죄도시2,주인공이 먼치킨이라서 다행인 영화…,10
그대가 조국,이 시대를 살아가는 사람으로서 꼭 봐야할 영화입니다.,10
닥터 스트레인지: 대혼돈의 멀티버스,"완다, 닥스 두 배우의 연기가 정말 좋았습니다.",7
턱시도,이 영화는 코미디 액션 영화다. 그 목적에 매우 충실한 영화 답게 계속 웃겼다. 배우들의 연기와 대사가 정말 너무 놀랍도록 웃기고 연출도 너무 탁월하다. 종종 다시 보고 싶은 영화다. 제니퍼 러브 휴잇이 이렇게 연기를 잘하는 지도 여태 몰랐다.,10
뷰티풀 마인드,음향이 특히 기억에 남아요,10
그대가 조국,진실을 알게 되었다.국민이 깨어있어야 한다,10
스파이더맨: 노 웨이 홈,지멋대로하더니 답답 말좀들어,10
범죄도시2,코로나 이후 정말 오랜만에 영화관에서 즐거운시간을 보냈네요 스토리도 좋고 연기력은 말할것 없고 1시간40분이라는 시간이 순싹  너무 무겁지않고 좋았어요 정말 재미지네요~,10
그대가 조국,나는 사실 조국사건때 정확한 팩트를 알지 못하였고 지금이라도 정확한 팩트를 알고 싶어 관람했다 영화 보는 내내 가슴이 답답함을 느꼈다 내 일은 아니지만 한 가정이 겪은 참담함을 피부로 느낄수 있었다 나도 모르게 눈물도 흘렸다 많은 사람들이 이 영화를 통해 미처 알지 못 했던 또는 오해하고 있었던 진실을 볼 수 있길 소망한다,10
시니어 이어,감동과 재미 둘 다 잡음~ 기분 좋아지는 영화 ,10
그대가 조국,대한민국 검찰수준을 다시 확인하게 되는 계기가 됩니다.,10
범죄도시2,전편만한 속편 없다는 말. 드디어 공식을 깼다. ,10
범죄도시2,명확하게 밝혀진 구씨의 과거... 그러나 솔직히 1편 win,6
범죄도시2,정말최고입니다 너무 잼있어요,10
케이프 피어,"이 영화가 이렇게 호평을 받고 있다니.. 아무리 30년이 넘은 영화라도 이건 너무 납득이 안 간다고 생각이 들었다. 악당에 대한 이렇다 저렇다 하는 설명 없이, 인간이 아닌 악마에 가까운 막강한 집착을 보여주고 있다.. 이것까지는 그렇다고 치자. 그런데 아무리 옛날옛적인데다 겁이 없다고 해도 그렇지.. 저 집 딸내미가 같은 수업 듣는 친구 하나 없이 지하에 가서 수업하러 간다? 그래.. 여기까지도 그럴 수 있다고 하자. 저 무서운 아저씨의 존재를 눈치 채고도 도망 갈 생각은 커녕 키스까지 함... 다른 사람은 어떨지 몰라도 나한텐 무척이나 개연성 떨어지는 모습으로 보였다. 그리고 탐정이라는 사람이 그렇게 허술하다니..ㅋㅋ;; 30년 넘었어도 너무하잖아.. 아무리 오래 전이라도 차라리 카메라를 하나 달아놓고 지켜보겠다.. 허술하게 곰인형에 줄 묶어놓고 바들바들 떨고 있는 거 뭐임. 다짜고짜 후다닥 옷차림 바꿔서 탐정은 피아노 줄로 죽임ㅎ.. 그뿐인가.  물에 빠져도 살아나고 자기 할매는 뱀 독을 마셨으며 할배는 교회에서 뱀을 잡는 일을 해서 유전이라고? 재미가 아예 없지는 않았지만 너무 두서없이 흘러가는 느낌. 상상력으로 만들어졌더라도 현실을 기반으로 해야 거부감 없이 즐길 수 있는 건데.. 아무튼 그냥 이런 거 저런 거 안 따지고 보면 스릴러 좋아하는 사람에겐 재미있을 순 있음.",1
범죄도시2,기대보다 더 재밌었습니다배우들 연기구멍이없어요,10
해리 포터와 불사조 기사단,예언자 일보 조중동 생각난다 호그와트 언론이 한국 언론이랑 비슷한 느낌,9
신정무문 디 오리지널,성룡이 아니고 나카타 히데토시가 나왔음...,8
언차티드,보물 훔치는게 너무 쉬워요 ㅠ ㅋㅋㅋㅋ,4
범죄도시2,여자는 출연도 안시키는 여혐 영화^^,1
범죄도시2,완전 기대한 만큼 좋은 작품,10
범죄도시2,오랜만에 영화관에서 하하호호 웃으며 봤어요~!! 너무 재미있어요 꼭 보세요~~ 두시간 순?삭! ,10
그대가 조국,"검찰공화국의 민낯을 제대로 봤네요. 이런 나라에 살고 있는게 무섭습니다. 내가, 내 아이가 당할 수도 있다고 셩각하니 끔찍합니다",10
범죄도시2,보는 내내 두 손 꼭 잡고 집중해서 봤어요 진짜 너무 재밌어요,10
그대가 조국,너무 충격적이였습니다~ 한대 맞은 느낌~! 팝콘이  들어가질 않았어요~  꼭 바야될 영화~!,10
그대가 조국,보고 나면 생각이 많아집니다,10
우연과 상상,어떤 자막은 필사하고 싶었다.,8
범죄도시2,1보다 너무 졸작이고 내용도 전개도 너무 유치한데 평점이 이해가 안되네 ,1
그대가 조국,반드시 억울함이 풀릴수 있는 날이 오길,10
그대가 조국,그대가 조국  꼭 봐야할 다큐멘터리,10
디스 이즈 잉글랜드,This is Chauvinism,8
범죄도시2,한번더 보고싶을정도로 올해 스트레스 다날아감,10
범죄도시2,스트레스 풀기에는 짱입니다,10
범죄도시2,잼써잼써잼써잼써잼써잼써잼써잼써잼써잼써잼써잼써잼써잼써잼써잼써잼써잼써잼써잼써잼써잼써잼써잼써잼써잼써잼써잼써잼써잼써잼써잼써잼써잼써잼써잼써잼써잼써잼써잼써잼써잼써잼써잼써잼써잼써잼써잼써잼써잼써잼써잼써잼써잼써잼써잼써잼써잼써잼써잼써잼써잼써잼써잼써잼써잼써잼써잼써잼써잼써잼써잼써,10
범죄도시2,"기대에 부응하는 재미, 3 기대",10
범죄도시2,그냥 웃고 즐겨! 개연성 뭐 그런거 따질 필요가 있나? 잘될 수 있는 후속작의 조건은 모두 갖추고 있다 오락 영화로서 최고의 선택 나쁜 놈들을 때려잡는 주먹질의 카타르시스는 오로지 관객의 몫 그의 주먹은 프랜차이즈가 될 자격이 있다 ,7
조 블랙의 사랑,헉 이거 3시간짜리 맞냐??ㄷㄷ,10
카오스 워킹, 촬영은 2017.8월~11월까지 했다는데 개봉은 작년 2021년도에 한거네 헌데 tv에서 동시 상영을 했는지.. 이 영화를 tv에서 돈 주고 본 기억이 난다 근데 ㅋㅋㅋ 남자들의 생각이 상대방에게 다 보이는데 뭐 하러 또 스스로 생각을 하는지 이해가....ㅋㅋㅋ 그냥 혼자 말 하면 될걸 ㅋㅋ  그럼 영화가 안되려나? ㅋㅋ 감독은 왜 영화 내용을 그리 만들었는지..ㅋㅋ,3
그대가 조국,이게 영화냐! 라는 말이 가장 어울리는 영화평인듯,2
그대가 조국,디지털 ㅆㄹx로 남영동있으면벌써잡혀가 나라가바로잡혔을텐데,1
범죄도시2,한국형 히어로!! 속이 통쾌하게 싹 풀린다!!,10
범죄도시2,시간이 어떻게 지나갔는지 모르는 영화. 계속 긴장된상태로 한순간도 눈을뗄수 없는 재미가 있다~ ,10
오마주,선구자들에게 선사하는 그녀의 따뜻한 헌사 ,9
그대가 조국,우리나라 언론과 기득권 그리고 정치검찰의 더럽고 추악한 모습을 잊지말자!,10
그대가 조국,이건 무슨 종교 영화인가요?,2
그대가 조국,지금은 답답함이 더 크지만 그래서 더 함께합니다,10
그대가 조국,무엇보다 애들이 살아가면서 알아야 될 한국 법 적용의 현실이 ...관람 후 얘기할 것이 무척 많을겁니다.가족 모두 함께 보시길 강력히 추천!,10
그대가 조국,대한민국 사법기관 공정성에 대해다시한번  생각해본 시간이었다,10
