movie,sentence,score
노팅 힐,"배우라고 하는 직업에 대한 환상이 환상으로서 남아있던 시기에 제작된 영화임을 먼저 인지해야 할 것. 소재도 소재거니와, 중간중간의 몇 대사들도 그러하고, 등장인물의 급진적이었던 관계도 그러하고, 대개 현실에서는 거의 일어나기 어려운 것. &amp;#39; 내 명예는 아무것도 아니다 &amp;#39; 라고 말할 수 있는 사람도 거의 드물 것.",10
범죄도시2,킬링타임용으로 제격 ㅋㅋ ,8
의형제,처음부터끝까지 지루함없이 볼수 있는 영화ㅠㅠ,10
그대가 조국,검찰은 기소만하는 기소청으로 만들고거기의 수장은 기소청장 그리고 기소사로직책을 바꾸자/검찰이란 용어는 없애자,10
그대가 조국,정유라와 최순실은 왜 유죄이고? 왜 조국가족은 무죄인가?,1
인민을 위해 복무하라,사모님이 아닌 누님을 위해 복무하라 아닌가..^&amp;^,3
범죄도시2,"범죄도시2.로맨스 1도 없는 코메디 액션 영화 재미있어요.마트에서 싸우고, 차 안에서 싸우고, 사무실에서 싸우고, 집에서 싸우고, 버스에서 싸우고, 주차장에서 싸우고 ㅎ. 싸우는 곳 마다 웃음코드가 다 있음ㅎ",10
범죄도시2,존나재밌어요ㄹㅇ1편보면더재밌음,10
범죄도시2,진짜 ㅈㄴ 재밌다 와…. ㅈㄴ 웃기고 ㅈㄴ 멋있고 음문석 뭔데ㅠㅠㅜ 개섹시,10
그대가 조국,상영관에는 사람들이 없는데  평점은 높은(?) ,1
범죄도시2,음향이 시원시원하게 완죤 짱~^^홈시어터 갇구푸다요~,10
범죄도시2,하 그냥 너무 재밌음 추천추천추천추천,10
연애 빠진 로맨스,아 손석구 짱귀 졸귀손석구 로코 마니마니 나와주라,8
범죄도시2,간만에 재밌는영화 보고왔어여 ㅋㅋㅋ 넘재미씀 ㅠㅠ,10
그대가 조국,역대 최악의 쓰레기 영화 입나.. 딱 좌좀 개딸 개삼촌 대깨 주사파 사회주의를 위한 영화....사회주의자의 변명 그 이상도 이하도 아님.. 가족들은 죄다 감옥 갔는데 혼자 살겠다고.,1
범죄도시2,짱재미따 간만에 엄청 웃엇다 ,10
그대가 조국,좌파들 언론 장악 해놓고 아직도 조국 타령하노,1
범죄도시2,아주 즐겁게 본 영화!!!,10
그대가 조국,굿굿굿  넷플레스에서볼수있는그날까지,10
그대가 조국,"검찰권력과 무분별한 언론보도에 의해 존경받았고 법을 공부하고 명문 서울대 교수로서 가르쳤던 지도층의 한가정과 인간의 존엄성이 어떻게 무너지는가를 보았다. 힘없는 일반 개인들은 어떠한 일을 당해도 손쓸수 없다는 무력감이 더 무섭게 다가왔다.자신의 안위를 떠나 검찰개혁을 하려고하다 본인의 능력검증이 아니라 부인 자녀까지 파헤쳐서 그의 큰뜻을 막으려한 모습이  언론을 통해 보여 정말 공포스러웠는데 이 영화를 보며 마음이 더많이 아팠다.우리의 조국이 잘 되고 가정의 평화도 빨리 회복되길 간절히 바라며 조국 화이팅!!! 그리고 더 드리고 싶은 말씀이 있습니다.끝까지 품위를 지키시고 그 힘든 가운데에서 살아와주신 조국 전 장관님과 가족분들에게 깊은 감사를 드리고, 용기내어 출연해주신 증인분들과 감독님 정말 감사합니다. 이 다큐를 통해 조국 전장관님과 가족분들의 억울함이 조금이나마 해소되기를 바라며 이 영화를 온국만이 보고 판단하면 좋겠습니다. 유리한 재판증거가 다 무시된 판결에 정말 충격이었습니다!! 이 영화 안본 사람이 낮은 평점과 댓글 단것은 정말 비겁하다고 생각합니다. 조국 전장관님과 가족분들 존경합니다. 가족분들과 증인분들 모두 힘내세요!! 정의는 승리합니다♡♡♡",10
범죄도시2,정말 재밌게 봤어요. 마동석 액션연기 시원시원하네요. 보통 속편이 망한다는 말 있는데 범죄도시만큼은 아닌것같네요.,10
그대가 조국, 조국이 피해자랰ㅋㅋㅋ 코미디 영화죠?,1
그대가 조국, 조국이 피해자랰ㅋㅋㅋ 코미디 영화죠?,1
그대가 조국,이 영화는 조국장관님에 대해 잘못 이해하고 있는 분들에게 추천합니다.진실이 뭔지 알려주는 영화입니다.,10
그대가 조국,이 영화는 조국장관님에 대해 잘못 이해하고 있는 분들에게 추천합니다.진실이 뭔지 알려주는 영화입니다.,10
그대가 조국,이 영화는 조국장관님에 대해 잘못 이해하고 있는 분들에게 추천합니다.진실이 뭔지 알려주는 영화입니다.,10
범죄도시2,답답함없이 사이다스토리 너무 좋았어요~ 지루할틈이 없어요~~,10
그대가 조국,그냥 뭐 딱히 할말이없으 ㅎ,1
그대가 조국,머리가 안깨져서 그런지 저는 이런거 도저히 못보겠네요,1
그대가 조국,검사와 언론의 잔인함!!!윤석렬의 야비하고 끔찍한 인간성을 보면 치가 떨립니다!!!조국의 살아있음에 감사드립니다!!!,10
범죄도시2,재미있어요 ㅎㅎ 재미있어요 다들 재미있게~~~,10
범죄도시2,말이 필요없음출연진들 모두 연기가 ㅎㄷㄷ,10
범죄도시2,범죄도시3 기대됩니다.,10
그대가 조국,토나오는 영화네요! 그들만 공감할 수 있는 영화…속편으로 유라의 시간도 하나 만들어주시죠,1
나쁜 녀석들: 더 무비,너무유치해요....,2
닥터 스트레인지: 대혼돈의 멀티버스,마블영화중 재밌게본 영화,10
범죄도시2,2편의 재밌는 영화는 처음이네요어려운 시국에 이런 영화 만들어주세요,10
그대가 조국,많이들 봐주세요 꼭 봐야할영화입니다.많이 봐주세요,10
범죄도시2,그냥저냥 뻔한 스토리 내용비추,2
호빗 : 스마우그의 폐허,스마우그 용 주제에 왜케 섹시한가 했더니 베니였어.. 어쩐지..,10
그대가 조국,가슴이 먹먹해지는 실화~~,10
그대가 조국,검찰공화국의 민낯을 보다,10
그대가 조국,현 대통령은 아주 나쁜놈처럼 묘사해놀고 자기 편인 조국은 무슨 무고한 피해자인 것마냥 선동하는 쓰레기 영화.여러분들은 편향된 영화를 믿으시겠습니까 사법부를 믿으시겠습니까?한줄평&amp;#39;일말의 동정심도 들지 않는 퇴장이다.&amp;#39;,2
그대가 조국,기본적인 사실만으로 아주 건조하게  설명하는 영화입니다 많은 분들이 보시고 진실에 더 가깝게  다가가는 니회가 되었으면 합니다,10
그대가 조국,그래도 정의를 진실을 위해 산 삶이 아름답다. ,10
범죄도시2,베리배리베리메리베리굿,10
그대가 조국,안 봤으면 두고 두고 후회할 진실한 영화. 나의 소심하고 나약한 마음을 움직인 인생영화~,10
그대가 조국,한숨만 100번 넘게 쉬었던거 같음... ,10
범죄도시2,너무 재밌어요.액션 사운드가 너무 실감나요,10
응징자,퍼니셔가 현실에서도 존재 했으면 좋겠넹 ㅋㅋ세상의 악은 다 꿇어돌프 형님 전성기 시절 모습을 봐서 너무 행복 했다역대 최고의 액션  행님 눈에 찍히믄  다 뽀싸 삐노80년대를 대표 하는 레전드 명작이었다 칼 보단 역시 샷건이제,10
그대가 조국,진실압에서 그대를 응원합니다.,10
닥터 스트레인지: 대혼돈의 멀티버스,영화도 재밌고 모두 연기 잘했습니다~,10
신비한 동물들과 덤블도어의 비밀,재밋음 후속작이 기대됨,10
그대가 조국,세상을 보는 관점이 달라졌다좀 더 깊고 예리한  사회제도 현상에 관찰습관과  정치에도 깊은 관심을 갖고 살아야겠다 생각했다,10
범죄도시2,걍 마동석의 액션이너무좋음,10
그대가 조국,으으 어어 이이 아아 오오,1
범죄도시2,뭐하나 빠지는게 없음 아쉽지도 않음,10
그대가 조국,범죄자 미화하는 한 편의 쓰레기,1
닥터 스트레인지: 대혼돈의 멀티버스,연기자 분들의 연기가 좋긴 좋았지만 조금은 지루하더라구요,10
애덤 프로젝트,가벼우면서 가볍지 않은 감동...,9
범죄도시2,너무 잼 있게 봤었요 전 와우 2가 더 잼나요 꼭 보세요,10
그대가 조국,"대한민국은 누구의 나라일까?정치적 중립과 이성적 판단을 앞세우며, 그래도 조국이 잘못한 거 아니야? 너 너무 정치적으로 편향된 거 아니야? 다 똑같이 나쁜놈들 아니야? 라던 사람들에게. 꼭 한 번 봐주시면 감사하겠습니다.",10
화려한 휴가,한사람때문에 벌어진 일 ㅠ,10
그대가 조국,보면서 가슴이 뭉클했습니다 ... 끝까지 힘내시길 응원합니다 !! ,10
닥터 스트레인지: 대혼돈의 멀티버스,재미있게 잘 봤습니다1!,8
로건,히어로물의 완벽한 피날레.,10
범죄도시2,넘 재밌게 봤어요!1번 더 보고 싶은 영화!,10
범죄도시2,아진짜 너무 재밌게 봤어요눈도 안깜빡여서 눈아파요,10
그대가 조국,범죄도시가 따로 없구나 원조 범죄도시 함께 보시죠^^,10
레벤느망,뭐라고 적을까요? &amp;#34;유산&amp;#34; 그리고 다음장면에서 마치 새로운 삶을 사는듯이 주인공에게 밝게 비추는 햇빛까지 연출 스토리 미쳤음. 중고교 필수 성교육 영상임,10
닥터 스트레인지: 대혼돈의 멀티버스,영상미는 화려했지만 이야기가 너무 재미가 없었습니다,6
범죄도시2,액션 볼말하고 재밌네요 ~,9
컨테이젼,현재의 팬데믹과 너무나 흡사한 상황 전개에 경악할 정도...재난상황을 담담히 기술하는 감독의 연출력과 세련된 편집능력 ,10
닥터 스트레인지: 대혼돈의 멀티버스,닥터는 어디가고 호러가. 잘생김을 연기하다 잘생겨져버린 그분.,6
범죄도시2,코로나 이후로 영화관에서 본 첫영화인데 두시간동안 박장대소 하면서 정말 재밌게 봤어요!!좋은영화 맹들어주셔서 감사합니다,10
그대가 조국,모두가 보아야한다..,10
그대가 조국,내용이 편향된것 같았습니다. 불편했어요,1
그대가 조국,드라마였음좋겠는데 이게 현실이라니 열받고 슬프네요 ,10
그대가 조국,검찰과 언론 그리고 정치계가 한 집안을 어떤식으로 죽이는지 적나라하게 목격하게 된다. 오로지 한 사람을 없애기 위해 온 나라의 권력들이 손을 잡아야됐던 것을 보며 조국이 정말 대단한 인물이구나 하고 새삼 놀랐다,10
컨테이젼,"잔혹한 바이러스와 냉혹한 카메라, 과장하지 않은 리듬감이 빼어나다.",7
범죄도시2,시즌1을 잊게만드는 2의 매력..3.4.5  가즈아~~,10
범죄도시2,1은 아우라가 강한 장첸이었다면 2는 살기가 가득한 강해상,10
극장판 주술회전 0,친구가 주술회전 영화 을 꼭 보라고 간곡한 추천을 해서 친구랑 오늘 영화 보러 왔는데 초반에는 좀 잠잠 해지다가 마지막 후렴 에 부분에서 백기양해 전쟁 선포 할때 엄청 짜릿하게 진지하게 볼만큼 감동 받으면서 울었습니다. 얼른 주술회전 1편 다 왔으면  좋겠습니다. 마지막에 주인공 능력치 가 장난이 아니더라고요  주술회전  앞으로 응원도 많이 하고 주술회전 활약상 기대하겠습니다사랑합니다 ,10
브루클린,"낯설음, 어색함, 두려움 그리고 친밀함 ",9
범죄도시2,1편보다 잔인하지만. 통쾌!!! 믿보 마동석!! 손석구 연기도,10
그대가 조국,이걸 돈주고 보는 놈들은 뭐냐??감독은 이런걸 만드는 이유가뭐지???,2
그대가 조국,꼭 보시고 평가들 해 보세요.,10
범죄도시2,빌런이 너무 섹시해요 마동석 배우 너무 귀여워요,10
그대가 조국,이게 평점이 9.87? ㅋㅋㅋ,1
그대가 조국,국민이 얼마나 정신못차렸으면 평점이 어잌흐ㅡ,1
그대가 조국,감사합니다. 조국장관님!,10
그대가 조국,"내로남불 조국,더 이상 보고싶지 않다",1
그대가 조국,꼭 봐야할 영화  입니다.,10
범죄도시2,정말 재밌어요 스트레스 다 날리고 왔습니다 마동석 배우님 짱영화 강추해요! ,10
범죄도시2,킬링용. 억지웃음유발 전작보다나은후속없다 는 확실한듯,4
그대가 조국,이거 왜만든지 이해불가,2
그대가 조국,할말을 잃게 만듭니다. 직접 보고 판단하시길. ,10
그대가 조국,대한민국의 참담함… 언젠가는 꼭 진실이 밝혀지리라 믿습니다. ,10
유체이탈자,계상이형 마지막에 못인난게 아쉬웠음,8
늑대들,전규환 감독님 작품 늘 잘보고 있습니다.,7
범죄도시2,1편 보다 나은 2편 입니다~,10
그대가 조국,역대급 범죄자 띄워주는 쓰레기 영화 돈낭비,1
범죄도시2,"검은 머리 외국인, 군대도 안간 연예인들은 이제 그만 퇴출시키자",4
그대가 조국,"언론 정상화! 검찰 정상화가 필요하다! 2022년 우리가 사는 이 시대 . . 가슴이 먹먹하고 깝깝하고 답답스럽다.. 반드시 선은 이기고, 진실은 역사가 평가하겠지! 시간이 걸리더라도. 거짓을 말하는 자 삶이 부끄럽지 아니한가?!.. ",10
그대가 조국,검사는 피고인을 골라 수사한다!!!사법부도 개혁이 필요함을 알게되었다자녀를 키우는 부모로써 이 사회가 이렇게 까지 불공정과 정의롭지 못함에 불안하다깨어있는 국민들이 윤석렬을 심판하여야 한다,10
스나이퍼 레거시,역시 미국의 스나이퍼 영화는 재밌어!,10
"나, 다니엘 블레이크",초반에 블랙코미디 같은 대사에 낄낄거리며 보다가 눈물 펑펑 쏟았네... ,10
범죄도시2,굳이..실제로 일어난 사건을 모티브로 썼어야 했는지 넘 자극적이더라구요 재미를 떠나서 피해자와 그 유족들에 대한 배려가 아쉽네요 그래도 손석구 음문석 보석같은 배우들의 매력을 알 수 있어 좋았습니다,2
범죄도시2,개 쥐림 그냥 무조건 보셈 ㄹㅇ,10
내 생애 가장 아름다운 일주일,내인생에는 옵니버스 촤초였음 센세이션했음,10
그대가 조국,포스터에 적혀있었다. 이제 그대가 조국...무슨 말인지 전혀 눈치채지못했다.22년을 살아가는 모든 시민들.당신이라고 다음 조국이 되지말란법이 없다.. 나 역시 예외는 아닐꺼라하는 무거운 마음으로 극장을 나섰다. 왜 검찰과 언론을 정상화해야하는지 뼈저리게 느낄수있는 다큐였고 이것은 영화가 아니다 현실이며 일상이다. 남산의 부장들은 없어진게아니었다 저 깊숙히 철문뒤에 들어가앉아 현시대를 살아가는 그대들을 기다리고있다...,10
범죄도시2,속편의 대성공!!배우들의 연기와 적절한 코미디가 잘 어우러짐스릴 긴장감도 있고 대대박!,9
범죄도시2,배우분액션 이 대단했어요,10
그대가 조국,"지금 생각해도 가슴이 너무 아프고 나와는 상관없는정치인의 가족이 당하는 모습을 보면서 절망을 느낀며...21세에도 검찰과 법원,언론이 입민재판이 가능하구나?",10
범죄도시2,진심 최상ㅋㅋㅋㅋ2를 너무잘만들었음아 최고였다 ,10
뺑반,"별점 주기도 아까움, 배우들이 아까움, 내 시간도 아까움.",1
그대가 조국,"2019년 이전에 조국을 좋아한적은 없었습니다. 그냥 말 어렵게 하는 교수로 알았죠. 언론에서 난리났을때도 한편으론 기레기들이 심하네, 싶다가 한편으론 뭐가 있겠지 그랬던 사람입니다. 지금 와선 그냥 이 가족과 주변인들에게 미안하네요. 미안합니다..어떤일이 있었는지 궁금해서 봤습니다. 영환 막 조국 편을 다 들어주는 감정적 내용이 아닙니다. 어떤일이 있었는지, 검찰 조사와 법원 재판은 어땠는지 알려줍니다. 피상적으로만 알던분들이 많이 보셨음 좋겠습니다. 형사사건도 대략 어떻게 돌아가는지 알 수 있어서 좋았습니다.재심의 기회가 있길, 조국과 주변 분들의 건강과 평안을 빕니다.",10
그대가 조국,검찰은 원하는 답이 정해져 있고 그 답을 안하면...검찰이 무서워 솔직한 평을 못 적겠습니다.,10
안나 카레니나,조라이트 감독의 영상미랑 연출은 최고 욕망은 결국 파국.진심은 결국 통한다,8
닥터 스트레인지: 대혼돈의 멀티버스,개재밌는데 ㅋㅋ 이게 재미가 없다고? ㅋㅋ 감정결여 ㄹㅇ ㅋㅋ,10
범죄도시2,그냥... 장첸이 그립드라,6
그대가 조국,그냥 내용이 쓰레기 ㅋ 대깨영화 ㅋ,1
범죄도시2,간만에 시원한 얙션과 통쾌함~,10
히든,갬블과 액션의 만남 정혜인님 액션 좋았어요!,10
히든,너무 재밋네요!! 액션도 좋고 연기들도 너무 잘하셔서 재밌게 잘 봤습니다!!!,10
범죄도시2,여전히 가렵다.대한민국에서 영화 흥행 공식“ ‘표적’ 을 만들고 죽도록 패라. “이유는 필요 없다. ,2
배드 가이즈,너무 재밌게 봤고 캐릭터들이 다 귀여워요 1시간 동안 즐겁게 본 것 같아요!!,10
그대가 조국,누구든 직접 덩하지 않으면 알수없는 무서운 검찰..반드시 그 검을 뺏아야 합니다,10
범죄도시2,말해 뭐해…진짜 최고의 대작 ,10
범죄도시2,또보세요 두번보세요 세번보세요,10
아직 사랑하고 있습니까?,"아니 베댓 꼰대들이 이리 많은가? 이걸 영화로 봐야지 무슨 야동보듯이 보냐? 그럼 니들이 그리 좋아하는 헐리웃 영화배우 다이안레인,엘리자베스올슨,에바그린,안젤리나졸리,기네스페트로,나탈리포트만,니콜키드먼,샤론스톤,나오미왓츠,케이트블란쳇,틸다스윈튼등등 유명 헐리웃 배우들도 작중 배드신 찍은거 많아 하여간 개인 사생활 문제를 작중 영화랑 엮을 생각을 하다니 기가 차서 말이 안나온다.",6
그대가 조국,????;;;; @@,2
범죄도시2,진짜 기대이상으로 재밌다,10
그대가 조국,조국 교수님..그리고 가족분들 힘내세요..감사하고 죄송합니다..ㅜㅜ,10
범죄도시2,장첸과는 또 다른 마력손석구님 연기 미쳤다진짜 ,10
그대가 조국,진실이 언제쯤 제대로 밝혀질지.. 이 영화를 통해 시작점이 되기를...,10
그대가 조국,최악너무쟈미없습니당,1
톨 걸 2,"힐링되는 하이틴영화! 남주 기여워ㅠㅠ 근데 여주가 놀림받는 설정인데 솔직히 이해안됨ㅎㅎ 덩치가 좀 있을뿐 팔다리 가늘고 날씬한데,,",10
범죄도시2,1만큼 진짜 재밋습니다 개그요소도 너무웃기고 액션이 엄청 시원시원합니다 역시 K히어로 마동석!!,10
그대가 조국,역대급 또라이 개검+언론들로 인해한가정이 무참히 짓밟혀졌다언젠가는 진실이 밝혀지고범죄자들은 벌을 달게 받을날이 오겠지.이를 모른체한 민주당도 책임져라,10
범죄도시2,보면 절대 후회는 안할듯! 넘 재밌었어요,10
자산어보,정약용의 형제 관계에 대해 알게되어서 흥미로웠다,9
그대가 조국,ㅋㅋㅋ이게 9점이라는게 말이되나,1
범죄도시2,근래 본 영화 중 가장 재밌었습니다!!,10
그대가 조국, 검찰한테 밉보이면 살아남을 수 없다,10
그대가 조국,지금 세상을 살아가는 우리 모두 잊지말아요,10
그대가 조국,별 하나도 아까움  ㅅㄹㄱ영화ㅜ,1
그대가 조국,하아~ 소름끼치네요지금의 상황들이,10
기묘한 가족,"《부산행》,《반도》,《#살아있다》랑은 전혀 다른 좀비들",6
그대가 조국,검찰공화국의 세상을 잘보여줌,10
범죄도시2,개꿀잼악역도 형사도 개매력 적임,10
그대가 조국,쓰레기 영화임이런걸 영화로내는 감독은 무슨생각으로 사는지,2
사이버 지옥: N번방을 무너뜨려라,"이 사건이 사회에 알려질때 너무 열 받으면서 보았는데, 이 사건이 조명 되기까지의 과정들을 세세하게 담아주셔서 감사합니다. 음악이 정적인듯 정적이지 않고, 화려한듯하나 요란하지 않아서 너무 좋았구요. 마지막 희망의 메시지를 전하는듯한 ost가 그동안의 모든 긴장과 불안을 해소시켜주는 것 같아서 아주 좋았습니다 ! :)",10
몬스터 싱어: 매직 인 파리,10년 전에 봤나? 재미있음 추천합니다,10
범죄도시2,재밌다 재밌어 ㅋ 역시. 마동석,10
뜨거운 피,너무 기대 했나? 난 진짜 별로 였음 범죄도시2 보세요,1
범죄도시2,믿고보는 마동석 액션! 영화 넘 잼있었네요~중간쯤 등장하는 장이수 캐릭은 미워할수 없는. 귀요운 악역ㅋㅋ3탄에도 꼭 출연시켜주세요!,10
범죄도시2,상업영화를 어떻게 만들어야되는지 보여주는 영화 가볍게 보기 너무 좋은 웰메이드 영화,10
봄날,잘 나갈땐 유쾌하지만 인생의 끝자락은 씁쓸하다,9
범죄도시2,시간 가는 줄도 모르고 봤음ㅎㅎ 진짜 너무 재밌어요,10
그대가 조국,민중에게 권력을권위에 저항하라 ,10
그대가 조국,ㅠㅠ 클레멘타인 급의 감동이군요,1
범죄도시2,개꿀잼 ㅋㅋ 꼭보새요~ 1보고 보는거 추천,10
범죄도시2,오랜만에 가족끼리 재밌게 봤습니다~액션굿,10
그대가 조국,많은사람들이 봐서 진실을 깨달았으면,10
범죄도시2,전편보다 훨씬 잼있내요코믹과액션을 적절하게~ 스토리 또한 실제 있었던 사건을 모티브로 한  내용이더군요마동석 펀치  역대급 ~  조연들도  연기 진짜 미침이요티비로  마동석 스페셜 자주하더라고요꼭 1편보시고  후편 보시길~^^ 또 봐도 잼있을것같아요진짜  최고의 한국영화  사랑합니다 한국영화,10
맨 프럼 어스,의미없이 사랑이나 해대면서 관객의 눈을 즐겁게 하는 영화 보단 의미 깊고 비교가 안되는 영화. 영화의 위상을 높이는 영화,10
그대가 조국,검찰 개혁의 이유를 명백히 알겠습니다,10
범죄도시2,그냥그냥그냥 잼있어요,10
범죄도시2,진짜 마동석 배우만 할 수 있는 액션 연기 너무 재밌고 스토리 몰입감 장난 없음시간 도둑맞고 정말 재밌음 ㅠㅜㅜㅠ 시리즈 계속 내주세요  기존 캐미도 너무 좋다 ㅋㅋ 중간중간 작년 명대사까지 최고!!!,10
그대가 조국,모든 국민이 꼭 봐야하는 영화검찰집단이 어떻게 한사람과 한 가정을 파괴시키는지 잘 보여주는 영화우리나라의 현실을 잘 보여주는 영화,10
그대가 조국,진실을 알고 싶은분들은 꼭 보세요슬프고 분하고 아쉽고 그러네요대한민국 국민들이라면 시청 강추 합니다,10
유체이탈자,노숙자 없었으면 어쩔뻔,2
범죄도시2,정말 다들 연기넘 재밌어요,10
그대가 조국,좋았어요. 이렇게 생각이 많아지게 하는 영화는 또 오랜만이었네요.. 끊임없이 공부해야겠다는 다짐이 들어요.,10
범죄도시2,"몰입감,타격감 최상입니다",9
더 노비스,더 잘하고 싶다는 욕망과 경쟁심리를 연기력으로 소화해냈습니다.,7
범죄도시2,직접 보세요후회안합니다,10
몬스터 싱어: 매직 인 파리,더빙인데도 어른들이 보기에도 꽤 재미있습니다. 아이들은 정말 즐거워할 것 같습니다.,8
그대가 조국,"지금은 2022년, 정치, 수사, 판결은 1970년, 언론과 온라인의 민주화 운동이 다시 시작되어야 한다. &amp;#39;그대가 조국&amp;#39; 영화를 봐야하는 이유!",10
범죄도시2,강해상 연기 액션이 최고다,10
히든,스토리는 단조로우나 생각보다 정혜인 액션이 볼만함 킬링 타임용으로 괜찮은 영화,8
플레이그라운드,무책임하고 무능한 어른들의 대처와 상처받은 아이들이 대비되면서 경각심이 듭니다.,7
그대가 조국,"눈을 의심했던 광기의 2019년... 역사는 반복된다는 걸 지켜보고 있는 요즘, 우리가 놓치고 있는 것이 무엇인지를 보여주는 영화. 별로면 추천 안하려고 했는데 놓쳤던 부분의 분석과 영화적 몰입감도 훌륭했습니다. 추천합니다. ",10
그대가 조국,안녕하시긔 쌍화차 코코아,1
그대가 조국,정말 제가 몰랐던 내용 아니 외면했던 내용을 마주하니 제 자신이 자책되네요. 미약하나마 지금 제가 뭘 해야하나 생각하게 됩니다,10
그대가 조국,영화보는 내내 마음이  너무 무겁고 아팠어요~~~ㅠㅠㅠ ,10
그대가 조국,범죄인의 마지막 목소리… 조국이 신화속 인물도 아니고 이런 영화 참…,1
나쁜 녀석들: 더 무비,범죄자 특수수사대. 서사는 진부하고 캐릭터는 겉돌고 연출은 뜸금없다. 마동석으로 안되는 영화도 있구나. ㅠㅠ,4
범죄도시2,처음부터 잔인한 장면으로 시작을…잔인한거 잘 못 보시는분들은 영화보는데 약간 힘들수 있지만 마동석한테 진짜 반한 것 같고 스토리도 좋았숨니다 범죄도시1 안 보고갔는데 내용 연계는 딱히 안돼있어서 괜찮았어여,9
자산어보,시기를 잘못타고 태어난 영화. 서정적인 아름다움이 가득한 영화.,9
